{
  "version": "1.0.0",
  "engine": "unity",
  "tile_mappings": [
    {
      "tile_type": "T_Floor_IndustrialPlain",
      "asset_id": "Prefabs/AlienBase/T_Floor_IndustrialPlain"
    },
    {
      "tile_type": "T_Floor_IndustrialHazardStripe",
      "asset_id": "Prefabs/AlienBase/T_Floor_IndustrialHazardStripe"
    },
    {
      "tile_type": "T_Floor_GrateGasEmitter",
      "asset_id": "Prefabs/AlienBase/T_Floor_GrateGasEmitter"
    },
    {
      "tile_type": "T_Floor_AlienResin",
      "asset_id": "Prefabs/AlienBase/T_Floor_AlienResin"
    },
    {
      "tile_type": "T_Wall_PanelRiveted",
      "asset_id": "Prefabs/AlienBase/T_Wall_PanelRiveted"
    },
    {
      "tile_type": "T_Wall_AlienVeins",
      "asset_id": "Prefabs/AlienBase/T_Wall_AlienVeins"
    },
    {
      "tile_type": "T_Ceiling_PipeCluster",
      "asset_id": "Prefabs/AlienBase/T_Ceiling_PipeCluster"
    },
    {
      "tile_type": "T_Ceiling_GratedVent",
      "asset_id": "Prefabs/AlienBase/T_Ceiling_GratedVent"
    },
    {
      "tile_type": "T_Platform_EggBase",
      "asset_id": "Prefabs/AlienBase/T_Platform_EggBase"
    }
  ],
  "entity_mappings": {
    "spawn": {
      "prefab_or_class": "Prefabs/AlienBase/SpawnPoint"
    },
    "weapon_pickup": {
      "Chainsaw": "Prefabs/AlienBase/Pickup_Chainsaw",
      "Flamethrower": "Prefabs/AlienBase/Pickup_Flamethrower",
      "SMG": "Prefabs/AlienBase/Pickup_SMG",
      "Shotgun": "Prefabs/AlienBase/Pickup_Shotgun",
      "SniperRifle": "Prefabs/AlienBase/Pickup_SniperRifle",
      "Bazooka": "Prefabs/AlienBase/Pickup_Bazooka"
    },
    "hazard_volume": {
      "FloorGas": "Prefabs/AlienBase/Hazard_FloorGas",
      "SublevelAcid": "Prefabs/AlienBase/Hazard_SublevelAcid"
    },
    "objective": {
      "Egg": "Prefabs/AlienBase/AlienEgg"
    }
  }
}
